{
  "schema_version": 1,
  "upstream": {
    "repository": "TangSY/aedifex",
    "commit": "5319368bae16500ca5267f6f8d68b36c9586d5bb",
    "license": "MIT",
    "plugin_api_version": 2
  },
  "decision": {
    "selected": "INTEGRATE_AEDIFEX_AS_BUILDING_AUTHORING_KERNEL",
    "world_core": "ARCZ_EARTH",
    "final_host": "SINGLE_TAURI_REACT_HOST",
    "transitional_host": "SANDBOXED_LOOPBACK_SIDECAR",
    "rejected": [
      "REPLACE_WORLD_CORE",
      "GLB_AS_EDITABLE_SOURCE",
      "REMOTE_RUNTIME",
      "BIG_BANG_RUST_REWRITE"
    ]
  },
  "authorities": {
    "ARCZ": [
      "WGS84/ECEF/ENU",
      "region/lot",
      "terrain/context",
      "procedural world",
      "jobs/budget",
      "cinema",
      "render",
      "Street",
      "provenance"
    ],
    "AEDIFEX": [
      "parametric building document",
      "2D/3D authoring",
      "all node kinds",
      "materials/catalog",
      "plugins",
      "IFC",
      "MCP building operations"
    ],
    "DERIVED": [
      "readonly GLB",
      "semantic manifest",
      "GeoAnchor",
      "revision/hash",
      "render passes"
    ]
  },
  "packages": [
    {
      "id": "@aedifex/core",
      "source": "packages/core/package.json",
      "authority": "AEDIFEX",
      "integration": "native scene schemas/store/history/registry remain authoritative",
      "target": "controlled Aedifex fork + ARCZ overlay",
      "status": "LOCKED_AND_MAPPED_BUILD_BLOCKED",
      "loss_policy": "NO_SOURCE_REWRITE; PATCH_MANIFEST_ONLY",
      "tests": [
        "commit/version/license lock",
        "offline build",
        "upstream tests",
        "ARCZ overlay syntax/E2E"
      ],
      "blockers": [
        "AEDIFEX_UPSTREAM_MISSING",
        "BUN_BUILD_NOT_EXECUTED"
      ]
    },
    {
      "id": "@aedifex/viewer",
      "source": "packages/viewer/package.json",
      "authority": "AEDIFEX",
      "integration": "native Three/R3F viewport mounted by the controlled host",
      "target": "controlled Aedifex fork + ARCZ overlay",
      "status": "LOCKED_AND_MAPPED_BUILD_BLOCKED",
      "loss_policy": "NO_SOURCE_REWRITE; PATCH_MANIFEST_ONLY",
      "tests": [
        "commit/version/license lock",
        "offline build",
        "upstream tests",
        "ARCZ overlay syntax/E2E"
      ],
      "blockers": [
        "AEDIFEX_UPSTREAM_MISSING",
        "BUN_BUILD_NOT_EXECUTED"
      ]
    },
    {
      "id": "@aedifex/editor",
      "source": "packages/editor/package.json",
      "authority": "AEDIFEX",
      "integration": "single Floorplanner/inspector/catalog/tool surface",
      "target": "controlled Aedifex fork + ARCZ overlay",
      "status": "LOCKED_AND_MAPPED_BUILD_BLOCKED",
      "loss_policy": "NO_SOURCE_REWRITE; PATCH_MANIFEST_ONLY",
      "tests": [
        "commit/version/license lock",
        "offline build",
        "upstream tests",
        "ARCZ overlay syntax/E2E"
      ],
      "blockers": [
        "AEDIFEX_UPSTREAM_MISSING",
        "BUN_BUILD_NOT_EXECUTED"
      ]
    },
    {
      "id": "@aedifex/mcp",
      "source": "packages/mcp/package.json",
      "authority": "SHARED",
      "integration": "in-memory MCP catalog bridged to ARCZ revisions and approvals",
      "target": "controlled Aedifex fork + ARCZ overlay",
      "status": "LOCKED_AND_MAPPED_BUILD_BLOCKED",
      "loss_policy": "NO_SOURCE_REWRITE; PATCH_MANIFEST_ONLY",
      "tests": [
        "commit/version/license lock",
        "offline build",
        "upstream tests",
        "ARCZ overlay syntax/E2E"
      ],
      "blockers": [
        "AEDIFEX_UPSTREAM_MISSING",
        "BUN_BUILD_NOT_EXECUTED"
      ]
    },
    {
      "id": "@aedifex/nodes",
      "source": "packages/nodes/package.json",
      "authority": "AEDIFEX",
      "integration": "builtinPlugin loads every locked native node kind",
      "target": "controlled Aedifex fork + ARCZ overlay",
      "status": "LOCKED_AND_MAPPED_BUILD_BLOCKED",
      "loss_policy": "NO_SOURCE_REWRITE; PATCH_MANIFEST_ONLY",
      "tests": [
        "commit/version/license lock",
        "offline build",
        "upstream tests",
        "ARCZ overlay syntax/E2E"
      ],
      "blockers": [
        "AEDIFEX_UPSTREAM_MISSING",
        "BUN_BUILD_NOT_EXECUTED"
      ]
    },
    {
      "id": "@aedifex/plugin-trees",
      "source": "packages/plugin-trees/package.json",
      "authority": "AEDIFEX_PLUGIN",
      "integration": "local Plugin API v2 admission for trees/flowers/grass",
      "target": "controlled Aedifex fork + ARCZ overlay",
      "status": "LOCKED_AND_MAPPED_BUILD_BLOCKED",
      "loss_policy": "NO_SOURCE_REWRITE; PATCH_MANIFEST_ONLY",
      "tests": [
        "commit/version/license lock",
        "offline build",
        "upstream tests",
        "ARCZ overlay syntax/E2E"
      ],
      "blockers": [
        "AEDIFEX_UPSTREAM_MISSING",
        "BUN_BUILD_NOT_EXECUTED"
      ]
    },
    {
      "id": "@aedifex/ifc-converter",
      "source": "packages/ifc-converter/package.json",
      "authority": "AEDIFEX_IMPORT",
      "integration": "local web-ifc conversion in a transactional ARCZ panel",
      "target": "controlled Aedifex fork + ARCZ overlay",
      "status": "LOCKED_AND_MAPPED_BUILD_BLOCKED",
      "loss_policy": "NO_SOURCE_REWRITE; PATCH_MANIFEST_ONLY",
      "tests": [
        "commit/version/license lock",
        "offline build",
        "upstream tests",
        "ARCZ overlay syntax/E2E"
      ],
      "blockers": [
        "AEDIFEX_UPSTREAM_MISSING",
        "BUN_BUILD_NOT_EXECUTED"
      ]
    }
  ],
  "apps": [
    {
      "id": "apps/editor",
      "authority": "REFERENCE_HOST_ONLY",
      "integration": "features folded into the single ARCZ floorplanner host; standalone app not shipped",
      "source": "apps/editor",
      "target": "@arcz/aedifex-floorplanner",
      "status": "MAPPED_BUILD_BLOCKED",
      "loss_policy": "NO_DUPLICATE_PROJECT_STORE",
      "tests": [
        "one Editor mount",
        "one chat",
        "one revision store"
      ]
    },
    {
      "id": "apps/ifc-converter",
      "authority": "REFERENCE_UI_ONLY",
      "integration": "converter package mounted in the unified Import/Export panel",
      "source": "apps/ifc-converter",
      "target": "ArczImportExportPanel",
      "status": "SOURCE_INTEGRATED_BUILD_BLOCKED",
      "loss_policy": "TRANSACTIONAL_ROLLBACK",
      "tests": [
        "local WASM copy",
        "scene validation",
        "revision conflict",
        "rollback"
      ]
    }
  ],
  "plugins": [
    {
      "id": "@aedifex/plugin-trees",
      "authority": "AEDIFEX_PLUGIN_API_V2",
      "integration": "treesPlugin plus treesHostPanel loaded once with duplicate guard and local assets",
      "source": "packages/plugin-trees",
      "target": "controlled floorplanner host",
      "status": "SOURCE_INTEGRATED_BUILD_BLOCKED",
      "loss_policy": "PLUGIN_PAYLOAD_PRESERVED",
      "tests": [
        "serialization",
        "clean unload",
        "SSR-safe admission",
        "asset license/provenance"
      ],
      "blockers": [
        "AEDIFEX_UPSTREAM_BUILD_MISSING"
      ]
    }
  ],
  "node_kinds": [
    {
      "id": "site",
      "category": "hierarchy_site",
      "source": "@aedifex/nodes",
      "authority": "AEDIFEX_BUILDING_AUTHORING_KERNEL",
      "document_authority": "AEDIFEX",
      "integration": "native registry → editor/viewport/tools → immutable ARCZ revision → validated export",
      "globe_policy": "READONLY_GLB_DERIVATIVE",
      "target": "arcz-cad-document/site-hierarchy",
      "rust_parity": "NOT_MIGRATED_UNTIL_GOLDEN_AND_ROUNDTRIP_GATES_PASS",
      "loss_policy": "FAIL_CLOSED_WITH_PER_FIELD_LOSS_REPORT",
      "feature_flag": "arcz.aedifex.rust_parity.site",
      "status": "PRESERVED_IN_PINNED_UPSTREAM_BUILD_BLOCKED",
      "tests": [
        "generated upstream inventory coverage",
        "native schema/serialization tests from pinned upstream",
        "Aedifex↔ARCZ golden round-trip before Rust activation",
        "GLB derivative hash/revision/GeoAnchor validation"
      ],
      "blockers": [
        "AEDIFEX_UPSTREAM_BUILD_MISSING",
        "RUST_KIND_PARITY_NOT_PROVEN"
      ]
    },
    {
      "id": "building",
      "category": "hierarchy_site",
      "source": "@aedifex/nodes",
      "authority": "AEDIFEX_BUILDING_AUTHORING_KERNEL",
      "document_authority": "AEDIFEX",
      "integration": "native registry → editor/viewport/tools → immutable ARCZ revision → validated export",
      "globe_policy": "READONLY_GLB_DERIVATIVE",
      "target": "arcz-cad-document/site-hierarchy",
      "rust_parity": "NOT_MIGRATED_UNTIL_GOLDEN_AND_ROUNDTRIP_GATES_PASS",
      "loss_policy": "FAIL_CLOSED_WITH_PER_FIELD_LOSS_REPORT",
      "feature_flag": "arcz.aedifex.rust_parity.building",
      "status": "PRESERVED_IN_PINNED_UPSTREAM_BUILD_BLOCKED",
      "tests": [
        "generated upstream inventory coverage",
        "native schema/serialization tests from pinned upstream",
        "Aedifex↔ARCZ golden round-trip before Rust activation",
        "GLB derivative hash/revision/GeoAnchor validation"
      ],
      "blockers": [
        "AEDIFEX_UPSTREAM_BUILD_MISSING",
        "RUST_KIND_PARITY_NOT_PROVEN"
      ]
    },
    {
      "id": "level",
      "category": "hierarchy_site",
      "source": "@aedifex/nodes",
      "authority": "AEDIFEX_BUILDING_AUTHORING_KERNEL",
      "document_authority": "AEDIFEX",
      "integration": "native registry → editor/viewport/tools → immutable ARCZ revision → validated export",
      "globe_policy": "READONLY_GLB_DERIVATIVE",
      "target": "arcz-cad-document/site-hierarchy",
      "rust_parity": "NOT_MIGRATED_UNTIL_GOLDEN_AND_ROUNDTRIP_GATES_PASS",
      "loss_policy": "FAIL_CLOSED_WITH_PER_FIELD_LOSS_REPORT",
      "feature_flag": "arcz.aedifex.rust_parity.level",
      "status": "PRESERVED_IN_PINNED_UPSTREAM_BUILD_BLOCKED",
      "tests": [
        "generated upstream inventory coverage",
        "native schema/serialization tests from pinned upstream",